DOI,Title
10.3390/clockssleep2010007,Träumen und Wachen im Schlafl abor: Die verschachtelte Realität des ›Lucid Dreaming‹
10.2466/pms.1995.81.2.658,Clinical Applications of Lucid Dreaming
10.2190/ic.29.3.h,On Moving the Eyes to Flag Lucid Dreaming
10.1016/s0191-8869(99)00078-1,Varieties of Lucid Dreaming Experience
10.3389/fpsyg.2021.635183,Dreaming the Virtual: How Lucid Dream Practice Can Inform VR Development
10.2466/09.pms.112.1.104-108,Vestibular Involvement in the Neurocognition of Lucid Dreaming
10.3389/fpsyg.2020.01826,"Transpersonal experiences in lucid dreaming, meditation and art: An inquiry into the spaces of the mind"
10.4324/9781315224701-20,Lucid dreaming: Evidence and methodology
10.3389/fpsyg.2018.00384,"Nieoniryczna konwencja ""literatury snu"". Lucid dreaming i postrealizm w ""Scenach łóżkowych"" Adama Wiedemanna"
10.3389/fpsyg.2020.00471,"Volitional components of consciousness vary across wakefulness, dreaming and lucid dreaming"
10.1080/15402002.2020.1739688,“DREAM HACKERS”. THE RELIABILITY OF LUCID DREAMING
10.4992/pacjpa.76.0_3pma21,Lucid Dreaming Brain Network Based on Tholey’s 7 Klartraum Criteria
10.1177/0276236616648653,Is It a Good Idea to Cultivate Lucid Dreaming?
10.1016/j.concog.2016.06.002,Lucid dreaming frequency and personality
10.1016/j.concog.2010.08.001,Increased Lucid Dreaming Frequency in Narcolepsy
10.1145/1236360.1236405,Neurobiology and clinical implications of lucid dreaming
10.3389/fnhum.2014.00717,Lucid Dreaming in Narcolepsy
10.1093/sleep/zsab294,Lucid Loop
10.1016/j.mehy.2020.110169,A Day in the Life of an Aesthetic Tāntrika: From Synaesthetic Garden to Lucid Dreaming and Spaciousness
10.4992/pacjpa.82.0_1am-068,Lucid dreaming and the bimodality of consciousness
10.1016/j.concog.2013.08.005,Lucid Dreaming as Metacognition: Implications for Cognitive Science
10.1111/ane.12362,Lucid Dreaming as a Treatment for Recurrent Nightmares
10.2466/pms.1990.71.2.627,Lucid dreaming during Multiple Sleep Latency Test (MSLT)
10.5860/choice.187262,Lucid dreams in veterans with posttraumatic stress disorder include nightmares.
10.1016/0301-0511(84)90056-5,"Dream recall, nightmares and lucid dreaming in narcoleptic patients"
10.1093/sleep/zsaa056.110,"What American College Students Want from Religion: Facebookismanity, Lucid Dreaming, and Bodhisattva Tupac Shakur"
10.1177/0276236615572594,Can Lucid Dreaming Research Guide Self-Transcendent Experience Design in Virtual Reality?
10.3389/fpsyg.2019.02618,Lucid Dreaming: A Diary Study
10.3389/fnhum.2013.00836,Lucid Virtual Dreaming: Antecedents and Consequents of Virtual Lucidity During Virtual Threat
10.1080/03080188.2017.1380468,"“Is this a Dream?” – Evolutionary, Neurobiological and Psychopathological Perspectives on Lucid Dreaming"
10.33824/pjpr.2022.37.2.12,"0239 Mindfulness Moderates the Relationship Between Lucid Dreaming, Nightmare Distress, and Sleep Quality"
10.1080/00048671003614213,"0731 THE RELATIONSHIP BETWEEN VIDEO GAME USE, GAME GENRE, AND LUCID/CONTROL DREAMING"
10.24832/jk.v11i1.18,Metacognitive Mechanisms Underlying Lucid Dreaming
10.1145/3173574.3173917,Lucid Dreaming Treatment for Nightmares: A Pilot Study
10.1007/s11263-019-01164-6,"THE MULTIPLICITY OF DREAMS: COGNITIVE-AFFECTIVE CORRELATES OF LUCID, ARCHETYPAL, AND NIGHTMARE DREAMING"
10.2466/pms.1982.55.3.795,Lucid Dreaming Frequency and Sensory-Processing Sensitivity
10.2466/pms.1981.52.3.727,1077 LUCID DREAMING IN VETERANS WITH PTSD: NON-NIGHTMARE DREAMS AND NIGHTMARES
10.5152/npa.2017.12606,Psychophysiological basis of lucid dreaming
10.2466/pms.1996.83.1.331,I did not expect to be dreaming: Explaining realization in lucid dreams with a Bayesian framework
10.2991/assehr.k.220105.288,The Phenomenology of Lucid Dreaming: An Online Survey
10.1038/s41467-018-05547-0,Lucid Dreaming and Control in Waking Life
10.3389/fpsyg.2020.555731,Lucid Dreaming: The Genre and Mode of The Man Who Was Thursday
10.1177/1363461520901638,Consciousness and Abilities of Dream Characters Observed during Lucid Dreaming
10.1016/j.slsci.2016.02.093,The Term “Hypnosis” Suggests a Sleep-Like State and Recent Evidence Regarding Lucid Dreaming Bears on the Notion of a “Hidden Observer.” What Is Your View of the Analogy of Dreaming and Hypnosis?
10.1111/jsr.12441,"Sleep spindles, mobile phones, lucid dreaming and sleep in Parkinson's disease and autism spectrum disorders"
10.5040/9781408164471.00000005,"Pre-sleep treatment with galantamine stimulates lucid dreaming: A double-blind, placebo-controlled, crossover study"
10.3366/edinburgh/9780748690954.003.0001,Individual differences in locus of control and the reporting of lucid dreaming
10.22323/1.321.0032,"Exploring the role of need for cognition, field independence and locus of control on the incidence of lucid dreams during a 12-week induction study."
10.31979/etd.pfcw-b8hy,Overcoming phobias by lucid dreaming.
10.3897/zookeys.21.271.app.3.ik,Partial memory reinstatement while (lucid) dreaming to change the dream environment
10.22323/1.340.0280,Two-Way Communication in Lucid REM Sleep Dreaming
10.1016/j.concog.2020.102988,Lucid Dreaming: Reliable Analog Event Detection for Energy-Constrained Applications
10.3389/fpsyg.2019.02946,Insight and Dissociation in Lucid Dreaming and Psychosis
10.30861/9781407316987,"Mindfulness, Meditation, and Lucid Dreaming: A Narrow vs. Broad-Spectrum Mindfulness Study"
10.1007/0-306-47949-4_7,Lucid Dreaming as a Learnable Skill: A Case Study
10.2307/j.ctt1287fvp.13,Lucid Dreaming and the Feeling of Being Refreshed in the Morning: A Diary Study
https://doi.org/10.3389/fpsyg.2020.01383,"Wake up, work on dreams, back to bed and lucid dream: A sleep laboratory study"
https://doi.org/10.3389/fpsyg.2020.01746,Findings from the international lucid dream induction study
https://doi.org/10.11588/ijodr.2020.1.71695,Lucid dream induction by auditory stimulation and reality testing during early-morning sleep
https://doi.org/10.3390/clockssleep4020021,Combining Wake-Up-Back-to-Bed with Cognitive Induction Techniques: Does Earlier Sleep Interruption Reduce Lucid Dream Induction Rate?
https://doi.org/10.3389/fpsyg.2021.635183,"“Is this a Dream?”–Evolutionary, Neurobiological and Psychopathological Perspectives on Lucid Dreaming"
https://doi.org/10.11588/ijodr.2020.2.74880,"Ring, ring, ring… Are you dreaming? Combining acoustic stimulation and reality testing for lucid dream induction: A sleep laboratory study"
https://doi.org/10.1080/02640414.2016.1267387,Improvement of darts performance following lucid dream practice depends on the number of distractions while rehearsing within the dream–a sleep laboratory pilot …
