DOI,Title
https://doi.org/10.3389/fpsyg.2020.01383,"Wake up, work on dreams, back to bed and lucid dream: A sleep laboratory study"
https://doi.org/10.3389/fpsyg.2020.01746,Findings from the international lucid dream induction study
https://doi.org/10.11588/ijodr.2020.1.71695,Lucid dream induction by auditory stimulation and reality testing during early-morning sleep
https://doi.org/10.3390/clockssleep4020021,Combining Wake-Up-Back-to-Bed with Cognitive Induction Techniques: Does Earlier Sleep Interruption Reduce Lucid Dream Induction Rate?
https://doi.org/10.3389/fpsyg.2021.635183,"“Is this a Dream?”–Evolutionary, Neurobiological and Psychopathological Perspectives on Lucid Dreaming"
https://doi.org/10.11588/ijodr.2020.2.74880,"Ring, ring, ring… Are you dreaming? Combining acoustic stimulation and reality testing for lucid dream induction: A sleep laboratory study"
https://doi.org/10.1080/02640414.2016.1267387,Improvement of darts performance following lucid dream practice depends on the number of distractions while rehearsing within the dream–a sleep laboratory pilot …
